sentenca,ambiente,bebida,comida,geral,localização,outros,preço,serviço
boa opção para carnes assadas a guarnição também é boa porém o salão é grande comporta muitas mesa o que naturalmente faz com que o barulho seja muito grande sem contar a televisão extremamente alta o que impossibilita o frequentador de poder conversar naturalmente com mais,1,0,1,0,0,0,0,0
o melhor petisco de manaus,0,0,1,0,0,0,0,0
restaurante com peixes típicos da região pratos muito saborosos e atendimento excelente com porções boa,0,0,1,0,0,0,0,1
lugar top demais música boa atendimento rápido casa aconchegante,1,0,0,1,0,0,0,1
pizzaria muito boa qualidade variedade ambiente local pra crianças,1,0,1,1,0,0,0,0
atendimento excelente bem localizado e com opções vegetarianas,0,0,1,0,1,0,0,1
se você gosta de um bom taco de rua essa é uma ótima escolha,0,0,1,0,0,0,0,0
ambiente limpo e agradável,1,0,0,0,0,0,0,0
